{
  "schemaVersion": 1,
  "engine": "yolo",
  "backend": "ncnn",
  "family": "ultralytics",
  "variant": "yolo11",
  "task": "detect",
  "input": {
    "name": "in0",
    "width": 640,
    "height": 640,
    "color": "RGB",
    "layout": "NCHW",
    "letterbox": true,
    "scale": 0.00392156862745098,
    "paddingValue": 114
  },
  "output": {
    "name": "out0",
    "decoder": "ultralytics-detect",
    "shape": [1, 5, 8400],
    "coordinates": "cxcywh",
    "objectness": false
  },
  "labels": [
    "synthetic-target"
  ]
}
